Message,GeminiScore,TensorFlowScore,IPQSScore,FinalScore,Explanation
Alert: Suspicious activity detected in your account. Please call our support at 123-456-7890 or visit https://safeverify.com,99,17.37,100,66,"The final fraud/spam risk score is 66, which indicates a moderate risk level."
Congratulations! You've won a $1000 gift card. Claim your prize now by clicking the link: http://bit.ly/win1000,100,100,100,100,"The final fraud/spam risk score is 100, which indicates a high risk level."
Exclusive offer just for you! Get 50% off on all products at our store. Visit us at http://shopnow.com,90,0,8,37,"The final fraud/spam risk score is 37, which indicates a low risk level."
"Hi John, don't forget our meeting tomorrow at 10 AM. Looking forward to it!",0,0,-1,0,"The final fraud/spam risk score is 0, which indicates a low risk level."
Reminder: Your dental appointment is scheduled for July 15th at 2 PM. Please reply 'Y' to confirm or 'N' to reschedule.,80,0,-1,40,"The final fraud/spam risk score is 40, which indicates a low risk level."
Urgent! Your bank account has been compromised. Verify your identity immediately at https://securebank.com,0,0,99,19,"The final fraud/spam risk score is 19, which indicates a low risk level."
Verify your email to receive the package. Click here: http://verifyemail.com,100,2.51,100,61,"The final fraud/spam risk score is 61, which indicates a moderate risk level."
Your OTP for the transaction at ABC Store is 123456. Do not share this code with anyone.,99,0,-1,49,"The final fraud/spam risk score is 49, which indicates a low risk level."
